{
  "contract_version": "0.1.0",
  "kind": "structured_query",
  "request_id": "req-01a04700000000000000000000000001",
  "contract": "open-pipeline-by-region@2",
  "parameters": {
    "as_of": { "type": "date", "value": "2026-06-30" },
    "region": { "type": "string", "value": "EMEA" }
  },
  "authorization": {
    "tenant": "acme",
    "uid": "analyst-7",
    "access_level": 2,
    "compartments": ["sales", "emea"],
    "session_id": "ses-01a047000000000000000000000000aa",
    "runbook_ref": "quarterly-review@3"
  },
  "limits": { "max_rows": 500, "max_bytes": 1048576 },
  "deadline_at": "2026-08-28T12:00:06Z",
  "freshness": { "max_staleness_seconds": 900, "on_violation": "refuse" },
  "seal": { "required": true, "retention_days": 400, "idempotency_key": "turn-9f3a-layer-1" }
}
